{
  "$schema": "../schemas/seed-lease-v1.schema.json",
  "format": "drop7-seed-lease-v1",
  "seedLeaseId": "SL-20260820T000000Z-00000000",
  "experimentId": "EX-20260820-replace-slug-00000000",
  "rngAlgorithm": "REPLACE_RNG_ALGORITHM_AND_VERSION",
  "domain": "environment",
  "role": "diagnostic",
  "rangeStartHex": null,
  "rangeEndExclusiveHex": null,
  "cohortManifestSha256": null,
  "state": "draft",
  "reservedAt": null,
  "openedAt": null,
  "closedAt": null,
  "protocolSha256": null,
  "runIds": [],
  "notes": [
    "Do not reserve this range until historical usage has been conservatively imported."
  ]
}
