{
  "$schema": "../schemas/seed-lease-v1.schema.json",
  "format": "drop7-seed-lease-v1",
  "seedLeaseId": "SL-20260907T041853Z-9a40ed51",
  "experimentId": "EX-20260907-ntuple-treestrap-gentle-step-087a3a63",
  "rngAlgorithm": "mulberry32 with mix32 domain separation (src/core/native/engine.hpp); headless disc stream kNextDiscDomain, reveal stream kRevealDomain; Rust bitboard engine bit-identical (RS-20260824T075451Z-e89ea128)",
  "domain": "environment",
  "role": "training",
  "rangeStartHex": "0xa52f2d80",
  "rangeEndExclusiveHex": "0xa52f2e80",
  "cohortManifestSha256": null,
  "state": "opened",
  "reservedAt": "2026-09-07T04:20:34Z",
  "openedAt": "2026-09-07T06:31:51Z",
  "closedAt": null,
  "protocolSha256": "a880e8f091be35f7452517c0908ff1ee82e0fa08c783917deb6dc92574dad1d5",
  "runIds": [
    "RUN-20260907T041853Z-70c90dc9"
  ],
  "notes": [
    "Conservative import 2026-09-07: every 8-hex-digit constant under docs/, approaches/, src/, research/, artifacts/, web/content/ and scripts/ was enumerated (grep -rhoE '0x[0-9a-fA-F]{8}'). Between 0xa52f2d80 and 0xa5300000 the only constants are 0xa52f2d80 itself (the exclusive end boundary of the first TreeStrap experiment's screen lease SL-20260907T012358Z-74d0228f, never read there) and 0xa52fffff (the allocator pool's end); no constant lies in 0xa5c00000-0xa6000000. The ranges reserved here overlap no existing lease record and no protected (0x7d) or final (0xd7) prefix, and are disjoint from every block the n-tuple experiments read (training 0xa5300000-0xa54f0000, 0xa5500000-0xa56f0000, 0xa5800000-0xa59f0000 and 0xa5a00000-0xa5bf0000; validation 0xa52f2240-0xa52f2280, 0xa52f2280-0xa52f2380, 0xa52f2780-0xa52f2880 and 0xa52f2a80-0xa52f2b80; screens 0xa52f2140-0xa52f2240, 0xa52f2380-0xa52f2580, 0xa52f2580-0xa52f2780, 0xa52f2880-0xa52f2a80 and 0xa52f2b80-0xa52f2d80) and from the historical block 0xa5700000-0xa571869f.",
    "256-game paired validation block, training role: read once per arm before training by the warm start (point 0) and re-read at every validation point of each arm by the line-up ntuple-d3s7 / ntuple-1ply / fair-d3s7 on identical seeds; drives each arm's plateau stop rule, the choice of each arm's best point and the choice of the candidate TreeStrap arm, and therefore cannot confirm anything.",
    "Opened 2026-09-07T06:31:51Z by run RUN-20260907T041853Z-70c90dc9 for the warm start's point-0 validation and the validation line-up of every training point of the three arms; preregistration commit 85447c8, protocol a880e8f091be...",
    "Run RUN-20260907T041853Z-70c90dc9 completed 2026-09-07T11:37:22Z: read at point 0 and 7 + 6 + 6 validation points and once per arm by the fair-d3s7 control."
  ]
}
